{
  "compiled_at": "2026-10-24T00:00:00Z",
  "contract": 1,
  "errors": [],
  "packs": [
    {
      "assets": [
        {
          "bytes": 96,
          "path": "pod.svg",
          "sha256": "7d8583b3c4edef9fc3a081531f8b47874828a7e2e9e7bc26c8b4371ed996e07d"
        }
      ],
      "author": "OpsForge tests",
      "badges": [
        {
          "description": "Completed the introduction course.",
          "icon": "lamp",
          "id": "intro-done",
          "position": 0,
          "rule": {
            "min": 1,
            "type": "labs_passed"
          },
          "title": "Introduced"
        }
      ],
      "challenges": [
        {
          "content_hash": "f8ca6f717436e90f",
          "course": "k8s-intro",
          "difficulty": "easy",
          "files": [
            "pod.yaml"
          ],
          "hints": [
            "The kind is Pod."
          ],
          "id": "first-pod",
          "minutes": 10,
          "needs": [
            "k3s"
          ],
          "solution": {
            "pod.yaml": "apiVersion: v1\nkind: Pod\nmetadata:\n  name: web\nspec:\n  containers:\n    - name: web\n      image: traefik/whoami\n"
          },
          "starter": {
            "pod.yaml": "apiVersion: v1\nkind: Pod\nmetadata:\n  name: web\n"
          },
          "statement": "Run one pod named `web` from the image `traefik/whoami`.\n",
          "tests": [
            {
              "action": [],
              "name": "pod is ready",
              "probe": {
                "expect": {
                  "phase.exit": "== 0"
                },
                "steps": [
                  {
                    "name": "phase",
                    "run": {
                      "cmd": "./opsforge kubectl -n ${ns} get pod web -o jsonpath='{.status.phase}'"
                    }
                  }
                ]
              }
            }
          ],
          "time_limit_s": 60,
          "title": "First pod",
          "xp": 50
        }
      ],
      "content_hash": "dacc2de66d3478fe",
      "courses": [
        {
          "badge": "intro-done",
          "content_hash": "ad7ef344f4bcb582",
          "description": "A **tiny** course.\n",
          "id": "k8s-intro",
          "layout": null,
          "level": "beginner",
          "minutes": 33,
          "needs": [
            "k3s"
          ],
          "outcomes": [
            "Read a pod's status",
            "Write a pod manifest"
          ],
          "position": 0,
          "requirements": [
            "Basic shell use"
          ],
          "requires": [],
          "sections": [
            {
              "items": [
                {
                  "content_hash": "18e3d0e07448638c",
                  "id": "what-is-a-pod",
                  "minutes": 8,
                  "ref": "what-is-a-pod",
                  "title": "What is a pod",
                  "type": "lecture"
                },
                {
                  "content_hash": "61c63c2c869f2c32",
                  "id": "pods-check",
                  "minutes": 5,
                  "ref": "pods-check",
                  "title": "Pods check",
                  "type": "quiz"
                },
                {
                  "content_hash": "4a96800a992f8941",
                  "id": "meet-the-cluster",
                  "minutes": 10,
                  "ref": "meet-the-cluster",
                  "title": "Meet the cluster",
                  "type": "lab"
                },
                {
                  "content_hash": "f8ca6f717436e90f",
                  "id": "first-pod",
                  "minutes": 10,
                  "ref": "first-pod",
                  "title": "First pod",
                  "type": "challenge"
                }
              ],
              "layout": null,
              "minutes": 33,
              "needs": [],
              "title": "Pods"
            }
          ],
          "subtitle": "One of everything, for the compiler's golden test.",
          "title": "Kubernetes introduction"
        }
      ],
      "curricula": [],
      "description": "The golden fixture of the course compiler (one course with every item type).",
      "hint_penalty": 0.1,
      "id": "demo",
      "labs": [
        {
          "body": {
            "briefing": "The cluster spans three sites.\n",
            "files": [
              "hello.yaml"
            ],
            "minutes": 10,
            "namespace": "auto",
            "needs": [
              "k3s"
            ],
            "reset": "setup",
            "steps": [
              {
                "body": "```bash\nopsforge kubectl get nodes\n```\n",
                "check": {
                  "probe": {
                    "expect": {
                      "nodes.exit": "== 0"
                    },
                    "steps": [
                      {
                        "name": "nodes",
                        "run": {
                          "cmd": "./opsforge kubectl get nodes"
                        }
                      }
                    ]
                  }
                },
                "hints": [
                  "Use kubectl get."
                ],
                "id": "nodes",
                "title": "List the nodes"
              },
              {
                "body": "Apply `hello.yaml` in `${ns}`.",
                "check": {
                  "confirm": "Applied"
                },
                "id": "apply",
                "open": "hello.yaml",
                "title": "Apply a manifest"
              }
            ],
            "summary": "List the nodes and find which site each one is in.",
            "title": "Meet the cluster",
            "xp": 100
          },
          "content_hash": "4a96800a992f8941",
          "files": {
            "hello.yaml": "apiVersion: v1\nkind: ConfigMap\nmetadata:\n  name: hello\ndata:\n  greeting: hi\n"
          },
          "id": "meet-the-cluster",
          "layout": null,
          "minutes": 10,
          "needs": [
            "k3s"
          ],
          "requires": [],
          "summary": "List the nodes and find which site each one is in.",
          "title": "Meet the cluster",
          "xp": 100
        }
      ],
      "lectures": [
        {
          "content_hash": "18e3d0e07448638c",
          "course": "k8s-intro",
          "id": "what-is-a-pod",
          "markdown": "A pod is one or more containers that share a network namespace.\n\n![A pod](../../../assets/pod.svg)\n\n> [!NOTE]\n> Pods on `${node:c}` run in site c.\n",
          "minutes": 8,
          "resources": [
            {
              "title": "Kubernetes docs: Pods",
              "url": "https://kubernetes.io/docs/concepts/workloads/pods/"
            }
          ],
          "title": "What is a pod"
        }
      ],
      "path": "demo",
      "quizzes": [
        {
          "content_hash": "61c63c2c869f2c32",
          "course": "k8s-intro",
          "draw": null,
          "id": "pods-check",
          "minutes": 5,
          "pass": 70,
          "questions": [
            {
              "answer": [
                1
              ],
              "choices": [
                "Nothing",
                "A network namespace",
                "A node pool"
              ],
              "explain": "Containers in a pod share one network namespace, so they reach each other on localhost.",
              "id": "shared",
              "prompt": "What do the containers of one pod share?",
              "see": "what-is-a-pod",
              "type": "single"
            },
            {
              "answer": [
                0,
                1,
                3
              ],
              "choices": [
                "Pending",
                "Running",
                "Sleeping",
                "Succeeded"
              ],
              "explain": "Sleeping is not a phase.",
              "id": "phases",
              "prompt": "Which of these are pod phases?",
              "see": null,
              "type": "multiple"
            }
          ],
          "shuffle": true,
          "time_limit_s": null,
          "title": "Pods check",
          "xp": 20
        }
      ],
      "title": "Demo pack",
      "version": "1"
    }
  ]
}
